{
  "schema": "femprompt-prisma-reviewer/0.5",
  "reviewer": "ar2",
  "actor": "agent",
  "status": "ai-agent-reviewed",
  "updated": "2026-10-02T07:15:48Z",
  "ratification": {
    "run_id": "ratification-ar2-20260822",
    "method": "dual_blind_agent_review_with_independent_source_adjudication",
    "consensus_path": "tests/review-cases/agent-runs/ratification-ar2-20260822/consensus-coding.json",
    "consensus_sha256": "5efa0727c2e4a60795f66592d0357fc2d6e92afb9022ccebedd523c960e44d4c",
    "input_tracks": [
      {
        "reviewer": "rr1",
        "path": "tests/review-cases/agent-runs/ratification-ar2-20260822/tracks/rr1.json",
        "sha256": "0c85e461fc278db08f590987a5cc45fadbb6ff9837a2a73151d06e4202291b62"
      },
      {
        "reviewer": "rr2",
        "path": "tests/review-cases/agent-runs/ratification-ar2-20260822/tracks/rr2.json",
        "sha256": "1dacb64f26f67bf539381f4bcee8be3fa02a867bb52dbc1b9f6fe4e5483f35df"
      }
    ],
    "operator_acceptance": {
      "status": "accepted",
      "accepted_at": "2026-08-22T18:21:59.029Z",
      "basis": "User authorized direct integration into the real research data and execution through Milestone 1."
    }
  },
  "decisions": {
    "22KJL3PC": {
      "categories": {
        "AI_Literacies": 1,
        "Generative_KI": 2,
        "Prompting": 2,
        "Bias_Ungleichheit": 2,
        "Diversitaet": 1,
        "Fairness": 1
      },
      "decision": "Include",
      "override": false,
      "reason": null,
      "override_reason": null,
      "evidence": {
        "AI_Literacies": [
          {
            "term": "Therefore, users must be aware of potential stereotypes in ChatGPT ' s understan",
            "snippet": "Therefore, users must be aware of potential stereotypes in ChatGPT ' s understanding of cultural values when using it for cross-cultural interactions.",
            "ts": "2026-10-02T07:15:45Z",
            "origin": "human",
            "source_layer": "paper",
            "actor": "agent",
            "paper_id": "22KJL3PC",
            "work_id": "work:43443814-3f53-51e1-af1a-7a3fa57091cc",
            "version_id": "version:a351cf13-2fbc-530f-b085-c81667ad36d4"
          }
        ],
        "Generative_KI": [
          {
            "term": "Given the rapid advancement of large-scale language models, AI models, like Chat",
            "snippet": "Given the rapid advancement of large-scale language models, AI models, like ChatGPT, are playing an increasingly prominent role in human society.",
            "ts": "2026-10-02T07:15:45Z",
            "origin": "human",
            "source_layer": "paper",
            "actor": "agent",
            "paper_id": "22KJL3PC",
            "work_id": "work:43443814-3f53-51e1-af1a-7a3fa57091cc",
            "version_id": "version:a351cf13-2fbc-530f-b085-c81667ad36d4"
          }
        ],
        "Prompting": [
          {
            "term": "Furthermore, Study 3 created four kinds of prompt strategies and applied them to",
            "snippet": "Furthermore, Study 3 created four kinds of prompt strategies and applied them to decision-making tasks.",
            "ts": "2026-10-02T07:15:45Z",
            "origin": "human",
            "source_layer": "paper",
            "actor": "agent",
            "paper_id": "22KJL3PC",
            "work_id": "work:43443814-3f53-51e1-af1a-7a3fa57091cc",
            "version_id": "version:a351cf13-2fbc-530f-b085-c81667ad36d4"
          },
          {
            "term": "It also found that the four prompt strategies can effectively reduce the generat",
            "snippet": "It also found that the four prompt strategies can effectively reduce the generation of ChatGPT ' s stereotypes and biases.",
            "ts": "2026-10-02T07:15:45Z",
            "origin": "human",
            "source_layer": "paper",
            "actor": "agent",
            "paper_id": "22KJL3PC",
            "work_id": "work:43443814-3f53-51e1-af1a-7a3fa57091cc",
            "version_id": "version:a351cf13-2fbc-530f-b085-c81667ad36d4"
          }
        ],
        "Bias_Ungleichheit": [
          {
            "term": "These tasks are related to distribution, indicating that ChatGPT has cultural bi",
            "snippet": "These tasks are related to distribution, indicating that ChatGPT has cultural biases in distributive fairness.",
            "ts": "2026-10-02T07:15:45Z",
            "origin": "human",
            "source_layer": "paper",
            "actor": "agent",
            "paper_id": "22KJL3PC",
            "work_id": "work:43443814-3f53-51e1-af1a-7a3fa57091cc",
            "version_id": "version:a351cf13-2fbc-530f-b085-c81667ad36d4"
          }
        ],
        "Diversitaet": [
          {
            "term": "This can help us understand ChatGPT ' s perception of individuals from different",
            "snippet": "This can help us understand ChatGPT ' s perception of individuals from different countries and assess whether they hold cultural stereotypes.",
            "ts": "2026-10-02T07:15:45Z",
            "origin": "human",
            "source_layer": "paper",
            "actor": "agent",
            "paper_id": "22KJL3PC",
            "work_id": "work:43443814-3f53-51e1-af1a-7a3fa57091cc",
            "version_id": "version:a351cf13-2fbc-530f-b085-c81667ad36d4"
          },
          {
            "term": "This approach would facilitate more effective and respectful cross-cultural inte",
            "snippet": "This approach would facilitate more effective and respectful cross-cultural interactions.",
            "ts": "2026-10-02T07:15:45Z",
            "origin": "human",
            "source_layer": "paper",
            "actor": "agent",
            "paper_id": "22KJL3PC",
            "work_id": "work:43443814-3f53-51e1-af1a-7a3fa57091cc",
            "version_id": "version:a351cf13-2fbc-530f-b085-c81667ad36d4"
          }
        ],
        "Fairness": [
          {
            "term": "While both models display cultural bias, ChatGPT 4o exhibits it in fewer tasks, ",
            "snippet": "While both models display cultural bias, ChatGPT 4o exhibits it in fewer tasks, suggesting improved fairness in interactions",
            "ts": "2026-10-02T07:15:45Z",
            "origin": "human",
            "source_layer": "paper",
            "actor": "agent",
            "paper_id": "22KJL3PC",
            "work_id": "work:43443814-3f53-51e1-af1a-7a3fa57091cc",
            "version_id": "version:a351cf13-2fbc-530f-b085-c81667ad36d4"
          }
        ]
      },
      "ts": "2026-10-02T07:15:45Z",
      "reviewer": "ar2",
      "actor": "agent",
      "text_source": "raw",
      "work_id": "work:43443814-3f53-51e1-af1a-7a3fa57091cc",
      "version_id": "version:a351cf13-2fbc-530f-b085-c81667ad36d4",
      "version_type": "version_of_record",
      "preferred_version_id": "version:a351cf13-2fbc-530f-b085-c81667ad36d4",
      "selected_version_is_preferred": true,
      "analysis": {
        "fields": {
          "AN_Prompting_Role": [
            "Research_Instrument",
            "Recommended_Practice"
          ],
          "AN_Prompt_Techniques": [
            "Role_Persona",
            "General_Guidance"
          ],
          "AN_Bias_Axes": [
            "Nationality_Migration",
            "Language_Culture"
          ],
          "AN_Harm_Types": [
            "Stereotyping",
            "Direct_Discrimination"
          ],
          "AN_Mitigation_Stage": [
            "Prompt_Practice"
          ],
          "AN_Mitigation_Status": "Evaluated",
          "AN_Population": [
            "Not_SW_Specific"
          ],
          "AN_Task": [
            "None"
          ],
          "AN_Gender_Definition": "Not_Applicable",
          "AN_Bias_Definition": "Explicit",
          "AN_Gender_Understanding": [
            "Not_Applicable"
          ],
          "AN_Theory_Reference": "Yes",
          "AN_Coding_Basis": "Fulltext",
          "Studientyp": "Experimentell",
          "AN_Notes": "Three studies with ChatGPT 3.5 and 4o: cultural value scales (Study 1), 13 one-round decision tasks with country personas and country interactants (Study 2), four prompt strategies as intervention (Study 3). Role_Persona: 'If you are an ordinary individual from [the country]' as instrument; General_Guidance covers the debiasing cues 'From a fairness perspective,', 'As an independent individual, please make a choice according to your own ideas and', 'If you live in a future world.' and 'Imagine you live in a multicultural world,'. Evaluated: the prompt strategies reduced country differences to non-significance in most tested task-model combinations, but the personal-preference prompt failed in the GPT-4o public goods game (own experiment). Axes coded as the work names them, countries/nationality and cultural groups. Direct_Discrimination: allocation decisions (dictator, ultimatum, public goods) toward interactants vary with the nationality stated in the prompt; these are simulated game allocations, not real decisions about persons. Training-data and oversight recommendations in the discussion are outlook and not coded as stages. Theory: Hofstede's cultural dimensions and GLOBE dimensions frame the explanation of the bias sources. Gender appears only as the GLOBE dimension gender egalitarianism, not as an object. Review: Diversitaet teilweise, weil das Werk die Wahrnehmung von Personen aus 20 Laendern und einen respektvollen interkulturellen Umgang als nachgeordneten Teilaspekt behandelt. Direct_Discrimination beruht auf simulierten Zuteilungen im Spiel und bleibt ein Grenzfall fuer die Fachpruefung."
        },
        "undecidable": {},
        "codebook_version": "1.4.1"
      },
      "representative_record_id": "22KJL3PC",
      "provenance": {
        "annotation_id": "ar2:22KJL3PC",
        "annotation_type": "screening_decision",
        "actors": [
          {
            "id": "curation-provenance-unrecorded",
            "type": "person",